{
  "identity_schema": "benchx/default/v1",
  "description": "The default identity policy: every coordinate matches except a named list of system fields the former design never matched; anything else, including a fact an adapter adds later, matches.",
  "default": "match",
  "paths": {
    "/source/uri": {
      "normalize": {
        "rule": "canonical-uri"
      }
    },
    "/coordinates/environment/system/hostname": "ignore",
    "/coordinates/environment/system/os": "ignore",
    "/coordinates/environment/system/libc": "ignore",
    "/coordinates/environment/system/cpu": "ignore",
    "/coordinates/environment/system/gpu": "ignore",
    "/coordinates/environment/system/firmware": "ignore",
    "/coordinates/environment/system/container": "ignore",
    "/coordinates/environment/system/process/cgroup": "ignore"
  }
}
